{
  "version": "2.1.0",
  "contributors": ["TheAncientOwl"],
  "title": "Beautiful People",
  "artists": ["Ed Sheeran", "Khalid"],
  "type": ["acoustic"],
  "notes": [],
  "capo": 3,
  "chordIDs": ["C", "Am", "F", "Em"],
  "strumms": [
    ["D", "-", "-", "-", "D", "-", "D", "U", "-", "U", "D", "-", "D", "-", "D", "U"],
    ["D", "-", "-", "-", "D", "-", "D", "U", "-", "U"],
    ["D", "-", "D", "-", "D", "U"],
    ["D"]
  ],
  "sections": {
    "i": {
      "name": "intro",
      "times": 1,
      "entries": [
        {
          "renderer": "chords-v2",
          "data": ["x1 C 1 C 1", "> 0"]
        }
      ]
    },
    "m4": {
      "name": "main progression",
      "times": 4,
      "entries": [
        {
          "renderer": "chords-v2",
          "data": ["x1 Am 1 C 1 F 1", "> 0"]
        },
        {
          "renderer": "chords-v2",
          "data": ["x1 F 1 ? 0 Em 1", "> 1 2"]
        }
      ]
    },
    "p": {
      "name": "pre",
      "times": 1,
      "entries": [
        {
          "renderer": "chords-v2",
          "data": ["x1 Am 1 C 1 ? 0 F 1", "> 0 3"]
        }
      ]
    },
    "m3": {
      "name": "main progression",
      "times": 3,
      "entries": [
        {
          "renderer": "chords-v2",
          "data": ["x1 Am 1 C 1 F 1", "> 0"]
        },
        {
          "renderer": "chords-v2",
          "data": ["x1 F 1 ? 0 Em 1", "> 1 2"]
        }
      ]
    },
    "o": {
      "name": "outro",
      "times": 1,
      "entries": [
        {
          "renderer": "chords-v2",
          "data": ["x1 Am 1 C 1 F 1", "> 3"]
        }
      ]
    }
  },
  "order": ["i", "m4", "p", "m4", "m3", "p", "m4", "o"],
  "lyrics": false,
  "pdf": false,
  "res": [
    {
      "alias": "Beautiful People Guitar Tutorial 🎸 Ed Sheeran Guitar Lesson |Easy Chords|",
      "author": "GuitarZero2Hero ~ YouTube",
      "link": "https://youtu.be/caqQxg4cwDY"
    },
    {
      "alias": "Beautiful People Guitar Cover Ed Sheeran 🎸 |Tabs + Chords|",
      "author": "GuitarZero2Hero Express ~ YouTube",
      "link": "https://youtu.be/tlQvOA52XSc"
    }
  ]
}
