{
  "version": "2.0.0",
  "contributors": ["TheAncientOwl"],
  "title": "All I Want For Christmas Is You",
  "artists": ["Mariah Carey"],
  "type": ["acoustic"],
  "notes": [],
  "capo": 0,
  "chordIDs": ["G", "Em", "C", "D", "G/B", "Cm_3fr", "B7", "D7", "E7", "Am7"],
  "strumms": [["D"], ["D", "U"]],
  "sections": {
    "ibd": {
      "name": "intro",
      "times": 1,
      "entries": [
        {
          "renderer": "chords-v1",
          "data": [
            {
              "times": 1,
              "items": [[["0 G 1 Em 1 C 1 D 1"]]]
            }
          ]
        }
      ]
    },
    "sv": {
      "name": "slow verse",
      "times": 1,
      "entries": [
        {
          "renderer": "chords-v1",
          "data": [
            {
              "times": 1,
              "items": [
                [["0 C 1 G/B 1 C 1 Cm_3fr 1", "0 G 1 B7 1 Em 1 Cm_3fr 1", "0 G 1 E7 1 Am7 1 D7 1"]]
              ]
            }
          ]
        }
      ]
    },
    "ibs": {
      "name": "break",
      "times": 1,
      "entries": [
        {
          "renderer": "chords-v1",
          "data": [
            {
              "times": 1,
              "items": [[["1 G 4 Em 4 C 4 D 4"]]]
            }
          ]
        }
      ]
    },
    "v": {
      "name": "verse",
      "times": 2,
      "entries": [
        {
          "renderer": "chords-v1",
          "data": [
            {
              "times": 1,
              "items": [[["1 G 16 C 8 Cm_3fr 8"]]]
            }
          ]
        }
      ]
    },
    "c": {
      "name": "chorus",
      "times": 1,
      "entries": [
        {
          "renderer": "chords-v1",
          "data": [
            {
              "times": 1,
              "items": [[["1 G 6 B7 2 Em 6 Cm_3fr 1", "0 G 4 E7 4 Am7 4 D7 4"]]]
            }
          ]
        }
      ]
    },
    "b": {
      "name": "bridge",
      "times": 1,
      "entries": [
        {
          "renderer": "chords-v1",
          "data": [
            {
              "times": 2,
              "items": [[["1 B7 8 Em 8 Cm_3fr 8", "0 G 4 E7 4 Am7 8 D 8"]]]
            }
          ]
        }
      ]
    }
  },
  "order": ["ibd", "sv", "ibs", "v", "ibs", "v", "c", "ibs", "b", "v", "c", "ibs"],
  "lyrics": false,
  "pdf": false,
  "res": [
    {
      "alias": "All I Want For Christmas Is You Guitar Tutorial 🎄🎸Mariah Carey Guitar Lesson |Easy Chords|",
      "author": "GuitarZero2Hero ~ YouTube",
      "link": "https://youtu.be/2PZGR5vRDFE"
    },
    {
      "alias": "All I Want For Christmas Is You Guitar Cover Mariah Carey 🎸|Tabs + Chords|",
      "author": "GuitarZero2Hero Express ~ YouTube",
      "link": "https://youtu.be/bkDlng69K20"
    }
  ]
}
