{
  "version": "2.1.0",
  "contributors": ["TheAncientOwl"],
  "title": "I Miss You (Solo Acoustic)",
  "artists": ["Blink-182"],
  "type": ["acoustic"],
  "notes": [],
  "capo": 4,
  "chordIDs": ["G", "G/F#", "Em7", "A7sus4", "C", "Dsus2"],
  "strumms": [
    ["D", "-", "D", "-", "D", "-", "D", "U", "-", "U", "D", "-", "D", "-", "D", "U"],
    ["D", "-", "D", "-", "D", "-", "D"],
    ["U", "-", "U", "D", "-", "D", "-", "D", "U"],
    ["D"]
  ],
  "sections": {
    "i": {
      "name": "intro",
      "times": 2,
      "entries": [{ "renderer": "chords-v2", "data": ["x1 G 1 G/F# 1 Em7 1 G/F# 1", "> 0"] }]
    },
    "v1": {
      "name": "verse 1",
      "times": 3,
      "entries": [{ "renderer": "chords-v2", "data": ["x1 G 1 G/F# 1 Em7 1 G/F# 1", "> 0"] }]
    },
    "c": {
      "name": "chorus",
      "times": 2,
      "entries": [
        {
          "renderer": "chords-v2",
          "data": ["x1 G 1 ? 0 A7sus4 1", "x1 G/B 1 ? 0 Dsus2 1", "> 1 2"]
        },
        { "renderer": "chords-v2", "data": ["x1 C 1 C 1", "> 0"] }
      ]
    },
    "b1": {
      "name": "break 1",
      "times": 1,
      "entries": [{ "renderer": "chords-v2", "data": ["x1 G 1 - 1", "> 3"] }]
    },
    "v2": {
      "name": "verse 2",
      "times": 4,
      "entries": [{ "renderer": "chords-v2", "data": ["x1 G 1 G/F# 1 Em7 1 G/F# 1", "> 0"] }]
    },
    "b2": {
      "name": "break 2",
      "times": 1,
      "entries": [{ "renderer": "chords-v2", "data": ["x1 G 1 G 1", "> 0"] }]
    },
    "bg": {
      "name": "bridge",
      "times": 2,
      "entries": [{ "renderer": "chords-v2", "data": ["x1 Em7 1 G/F# 1 G 1 G/F# 1", "> 0"] }]
    },
    "cf": {
      "name": "chorus",
      "times": 6,
      "entries": [
        {
          "renderer": "chords-v2",
          "data": ["x1 G 1 ? 0 A7sus4 1", "x1 G/B 1 ? 0 Dsus2 1", "> 1 2"]
        },
        {
          "renderer": "chords-v2",
          "data": ["x1 C 1 C 1", "> 0"]
        }
      ]
    }
  },
  "order": ["i", "v1", "c", "b1", "v2", "c", "b2", "bg", "cf"],
  "lyrics": false,
  "pdf": false,
  "res": [
    {
      "alias": "I Miss You Guitar Tutorial Blink -182 Guitar Lesson Chords + TAB",
      "author": "GuitarZero2Hero ~ YouTube",
      "link": "https://youtu.be/kYsyB9xASyU"
    },
    {
      "alias": "I Miss You Guitar Cover Blink-182 🎸|Tabs + Chords|",
      "author": "GuitarZero2Hero Express ~ YouTube",
      "link": "https://youtu.be/SWkhIRk-bH4"
    }
  ]
}
