{
  "version": "2.1.0",
  "contributors": ["TheAncientOwl"],
  "title": "Without You",
  "artists": ["The Kid LAROI"],
  "type": ["acoustic"],
  "notes": [],
  "capo": 0,
  "chordIDs": ["Am", "F", "C", "G", "E"],
  "strumms": [
    ["Dx", "-", "Dx", "-", "Dx", "-", "Dx", "Ux"],
    ["D", "-", "-", "-", "D", "-", "-", "U", "-", "U", "D", "-", "D", "-", "D", "U"],
    ["D", "-", "D", "-", "D", "-", "D", "-", "D", "-", "-", "-", "Dx", "Ux", "Dx", "Ux"],
    ["D"],
    ["D", "-", "D", "-", "D", "-", "D", "-", "D", "-", "D", "-", "D", "-", "D", "U"],
    ["-", "-", "-", "-", "-", "-", "-", "-", "-", "-", "-", "-", "Dx", "Ux", "Dx", "Ux"]
  ],
  "sections": {
    "i": {
      "name": "intro",
      "times": 1,
      "entries": [
        { "renderer": "chords-v2", "data": ["x1 - 1", "> 0", "x1 Am 1 F 1 C 1 G 1", "> 1"] }
      ]
    },
    "c1": {
      "name": "chorus",
      "times": 1,
      "entries": [{ "renderer": "chords-v2", "data": ["x2 Am 1 F 1 C 1 G 1", "> 1"] }]
    },
    "v": {
      "name": "verse",
      "times": 1,
      "entries": [{ "renderer": "chords-v2", "data": ["x2 Am 1 F 1 C 1 G 1", "> 1"] }]
    },
    "pr1": {
      "name": "prechorus 1",
      "times": 1,
      "entries": [{ "renderer": "chords-v2", "data": ["x1 Am 1 F 1 C 1", "> 1", "x1 E 1", "> 2"] }]
    },
    "c2": {
      "name": "chorus",
      "times": 1,
      "entries": [{ "renderer": "chords-v2", "data": ["x1 Am 1 F 1 C 1 G 1", "> 1"] }]
    },
    "b": {
      "name": "bridge",
      "times": 1,
      "entries": [{ "renderer": "chords-v2", "data": ["x1 Am 1 F 1 C 1", "> 3", "x1 G 1", "> 4"] }]
    },
    "pr2": {
      "name": "prechorus 2",
      "times": 1,
      "entries": [{ "renderer": "chords-v2", "data": ["x1 Am 1 F 1 C 1", "> 1", "x1 - 1", "> 5"] }]
    },
    "o": {
      "name": "outro",
      "times": 1,
      "entries": [{ "renderer": "chords-v2", "data": ["x1 Am 1 F 1 C 1 G 1", "> 3"] }]
    }
  },
  "order": ["i", "c1", "v", "pr1", "c2", "b", "pr2", "c1", "o"],
  "lyrics": false,
  "pdf": false,
  "res": [
    {
      "alias": "Without You Guitar Tutorial The Kid LAROI Lesson |Easy Chords + Cover|",
      "author": "GuitarZero2Hero ~ YouTube",
      "link": "https://youtu.be/I8UfGA0qR7A"
    },
    {
      "alias": "Without You Guitar Cover The Kid LAROI 🎸|Tabs + Chords|",
      "author": "GuitarZero2Hero Express ~ YouTube",
      "link": "https://youtu.be/ayhT2swtB0w"
    }
  ]
}
