{
  "version": "2.1.0",
  "contributors": ["TheAncientOwl"],
  "title": "Flake",
  "artists": ["Jack Johnson"],
  "type": ["acoustic"],
  "notes": [],
  "capo": 0,
  "chordIDs": ["Dm_5fr", "F_1fr", "Bb_6fr", "C_8fr", "C_3fr", "A_5fr", "Bb_1fr"],
  "strumms": [
    ["D", "-", "D", "U", "Dx", "Ux", "Dx", "U", "-", "U", "-", "U", "Dx", "Ux", "Dx", "Ux"],
    ["D"],
    ["D", "Ux", "D", "Ux", "D", "Ux", "D", "Ux", "D", "Ux", "D", "Ux", "D", "Ux", "D", "Ux"],
    ["D", "Ux", "D", "Ux", "D", "Ux", "D", "Ux"]
  ],
  "sections": {
    "i": {
      "name": "intro",
      "times": 2,
      "entries": [
        {
          "renderer": "chords-v2",
          "data": ["x2 Dm_5fr 1 F_1fr 1 Bb_6fr 1 F_1fr 1", "> 0"]
        }
      ]
    },
    "v": {
      "name": "verse",
      "times": 1,
      "entries": [
        {
          "renderer": "chords-v2",
          "data": [
            "x3 Dm_5fr 1 F_1fr 1 Bb_6fr 1 F_1fr 1",
            "x1 Dm_5fr 1 F_1fr 1 Bb_6fr 1 C_8fr 1",
            "> 0"
          ]
        }
      ]
    },
    "c1": {
      "name": "chorus 1",
      "times": 1,
      "entries": [
        {
          "renderer": "chords-v2",
          "data": [
            "x2 F_1fr 1 C_3fr 1 Dm_5fr 1 A_5fr 1 / 0 Bb_6fr 1 C_8fr 1 F_1fr 1 C_8fr 1",
            "> 0"
          ]
        }
      ]
    },
    "v2": {
      "name": "verse",
      "times": 1,
      "entries": [
        {
          "renderer": "chords-v2",
          "data": [
            "x2 Dm_5fr 1 F_1fr 1 Bb_6fr 1 F_1fr 1",
            "> 1",
            "x1 Dm_5fr 1 F_1fr 1 Bb_6fr 1 F_1fr 1",
            "x1 Dm_5fr 1 F_1fr 1 Bb_6fr 1 C_8fr 1",
            "> 0"
          ]
        }
      ]
    },
    "c2": {
      "name": "chorus 2",
      "times": 1,
      "entries": [
        {
          "renderer": "chords-v2",
          "data": [
            "x3 F_1fr 1 C_3fr 1 Dm_5fr 1 A_5fr 1 / 0 Bb_6fr 1 C_8fr 1 F_1fr 1 C_8fr 1",
            "> 0"
          ]
        }
      ]
    },
    "o1": {
      "name": "outro pt.1",
      "times": 1,
      "entries": [
        {
          "renderer": "chords-v2",
          "data": ["x1 F_1fr 8", "> 2"]
        }
      ]
    },
    "o2": {
      "name": "outro pt.2",
      "times": 3,
      "entries": [
        {
          "renderer": "chords-v2",
          "data": [
            "x1 F_1fr 1 Bb_1fr 1 F_1fr 1 C_3fr 1 / 0 F_1fr 1 Bb_1fr 1",
            "> 2",
            "x1 C_3fr 1 Bb_1fr 1",
            "> 3",
            "x1 F_1fr 1",
            "> 2"
          ]
        }
      ]
    }
  },
  "order": ["i", "v", "c1", "v2", "c2", "o1", "o2"],
  "lyrics": false,
  "pdf": false,
  "res": [
    {
      "alias": "Struggling with Barre Chords? Learn “Flake” by Jack Johnson (Guitar Lesson)",
      "author": "GuitarZero2Hero ~ YouTube",
      "link": "https://youtu.be/rcpsgFHaFF8"
    }
  ]
}
