{
  "version": "2.1.0",
  "contributors": ["TheAncientOwl"],
  "title": "All Of Me",
  "artists": ["John Legend"],
  "type": ["acoustic"],
  "notes": [],
  "capo": 1,
  "chordIDs": ["Em", "C", "G", "D", "Am"],
  "strumms": [
    ["De", "D", "D", "De", "D", "D", "De", "D"],
    ["D"],
    ["D", "-", "D", "U", "D", "-", "D", "U", "-", "U", "D", "-", "D", "U", "D", "U"]
  ],
  "sections": {
    "i": {
      "name": "intro",
      "times": 1,
      "entries": [
        {
          "renderer": "chords-v2",
          "data": ["x1 Em 1 C 1 G 1 D 1", "> 0"]
        }
      ]
    },
    "v": {
      "name": "verse",
      "times": 1,
      "entries": [
        {
          "renderer": "chords-v2",
          "data": ["x4 Em 1 C 1 G 1 D 1", "> 0"]
        }
      ]
    },
    "p": {
      "name": "prechorus",
      "times": 1,
      "entries": [
        {
          "renderer": "chords-v2",
          "data": ["x1 Am 1 Am 1 G 1 D 1 / 0 Am 1 Am 1 G 1", "> 0", "x1 D 1", "> 1"]
        }
      ]
    },
    "c1": {
      "name": "chorus 1",
      "times": 1,
      "entries": [
        {
          "renderer": "chords-v2",
          "data": ["x2 G 1 Em 1 C 1 D 1", "> 2", "x2 Em 1 C 1 G 1 D 1", "> 0"]
        }
      ]
    },
    "c2": {
      "name": "chorus 2",
      "times": 1,
      "entries": [
        {
          "renderer": "chords-v2",
          "data": [
            "x1 G 1 Em 1 C 1 D 1",
            "> 1",
            "x1 G 1 Em 1 C 1 D 1",
            "> 2",
            "x3 Em 1 C 1 G 1 D 1",
            "> 0",
            "x1 Em 1 C 1 G 1 D 1",
            "> 1"
          ]
        }
      ]
    }
  },
  "order": ["i", "v", "p", "c1", "v", "p", "c1", "p", "c2"],
  "lyrics": false,
  "pdf": false,
  "res": [
    {
      "alias": "All Of Me Guitar Tutorial - John Legend Guitar Lesson 🎸 |Easy Chords + Guitar Cover|",
      "author": "GuitarZero2Hero ~ YouTube",
      "link": "https://youtu.be/HmG_oPsUVTs"
    },
    {
      "alias": "All Of Me Guitar Cover - John Legend 🎸 |Chords|",
      "author": "GuitarZero2Hero Express ~ YouTube",
      "link": "https://youtu.be/nrlMBzg06Js"
    }
  ]
}
