{
  "version": "2.1.0",
  "contributors": ["TheAncientOwl"],
  "title": "New Heart",
  "artists": ["Crash Adams"],
  "type": ["acoustic"],
  "notes": [],
  "capo": 0,
  "chordIDs": ["Am", "Dm", "G", "C", "E"],
  "strumms": [
    ["D", "U", "Dx", "U", "-", "U", "Dx", "U", "-"],
    ["D"],
    ["D", "-", "-", "-"],
    ["D", "D", "D"]
  ],
  "sections": {
    "i": {
      "name": "intro",
      "times": 1,
      "entries": [
        {
          "renderer": "chords-v2",
          "data": ["x1 Am 1 Am 1 | 0 Dm 1 Dm 1 / 0 G 1 G 1 | 0 C 1 E 1", "> 0"]
        }
      ]
    },
    "v1": {
      "name": "verse 1",
      "times": 1,
      "entries": [
        { "renderer": "chords-v2", "data": ["x1 Am 1 Am 1 | 0 Dm 1 Dm 1 / 0 G 1 G 1", "> 0"] },
        { "renderer": "chords-v2", "data": ["x1 C 1 ? 0 E 1", "> 2 3"] }
      ]
    },
    "c1": {
      "name": "chorus 1",
      "times": 2,
      "entries": [
        {
          "renderer": "chords-v2",
          "data": ["x1 Am 1 Am 1 | 0 Dm 1 Dm 1 / 0 G 1 G 1 | 0 C 1", "> 0"]
        },
        { "renderer": "chords-v2", "data": ["x1 E 1", "> 3"] }
      ]
    },
    "v2": {
      "name": "verse 2",
      "times": 1,
      "entries": [
        {
          "renderer": "chords-v2",
          "data": [
            "x1 Am 1 Am 1 | 0 Dm 1 Dm 1 / 0 G 1 G 1 | 0 C 1 E 1",
            "x1 Am 1 Am 1 | 0 Dm 1 Dm 1 / 0 G 1 G 1",
            "> 0"
          ]
        },
        {
          "renderer": "chords-v2",
          "data": ["x1 C 1 ? 0 E 1", "> 2 3"]
        }
      ]
    },
    "c2": {
      "name": "chorus 2",
      "times": 3,
      "entries": [
        {
          "renderer": "chords-v2",
          "data": ["x1 Am 1 Am 1 | 0 Dm 1 Dm 1 / 0 G 1 G 1 | 0 C 1", "> 0"]
        },
        {
          "renderer": "chords-v2",
          "data": ["x1 E 1", "> 3"]
        }
      ]
    },
    "pc": {
      "name": "post-chorus",
      "times": 1,
      "entries": [
        { "renderer": "chords-v2", "data": ["x1 Am 1 Dm 1 G 1 C 1", "> 1", "x1 E 1", "> 3"] }
      ]
    },
    "o1": {
      "name": "outro",
      "times": 2,
      "entries": [
        {
          "renderer": "chords-v2",
          "data": ["x1 Am 1 Am 1 | 0 Dm 1 Dm 1 / 0 G 1 G 1 | 0 C 1", "> 0", "x1 E 1", "> 3"]
        }
      ]
    },
    "o2": {
      "name": "outro",
      "times": 1,
      "entries": [{ "renderer": "chords-v2", "data": ["x1 Am 1", "> 1"] }]
    }
  },
  "order": ["i", "v1", "c1", "v2", "c2", "pc", "o1", "o2"],
  "lyrics": false,
  "pdf": false,
  "res": [
    {
      "alias": "967.Crash Adams - New Heart 기타커버【★★☆☆☆】 | Guitar tutorial 【TAB譜】",
      "author": "GuitarZero2Hero ~ YouTube",
      "link": "https://youtu.be/0G-Yxj_j9o4"
    }
  ]
}
