{
  "version": "2.0.0",
  "contributors": ["TheAncientOwl"],
  "title": "Wake Me Up",
  "artists": ["Avicii"],
  "type": ["acoustic"],
  "notes": [],
  "capo": 2,
  "chordIDs": ["Am", "Ft", "G", "C/G", "E"],
  "strumms": [
    ["D", "-", "D", "-", "-", "U", "D", "U"],
    ["D", "-", "D", "U"]
  ],
  "sections": {
    "i": {
      "name": "intro",
      "times": 1,
      "entries": [
        {
          "renderer": "chords-v1",
          "data": [
            {
              "times": 1,
              "items": [[["0 Am 1 Ft 1 C/G 2"], ["1 G 1"]]]
            },
            {
              "times": 1,
              "items": [[["0 Am 1 Ft 1 C/G 2"], ["1 E 1"]]]
            }
          ]
        }
      ]
    },
    "c": {
      "name": "chorus",
      "times": 1,
      "entries": [
        {
          "renderer": "chords-v1",
          "data": [
            {
              "times": 1,
              "items": [[["0 Am 1 Ft 1 C/G 2"], ["1 G 1"]]]
            },
            {
              "times": 1,
              "items": [[["0 Am 1 Ft 1 C/G 2"], ["1 E 1"]]]
            }
          ]
        }
      ]
    },
    "d": {
      "name": "dance",
      "times": 1,
      "entries": [
        {
          "renderer": "chords-v1",
          "data": [
            {
              "times": 1,
              "items": [[["0 Am 1 Ft 1 C/G 2"], ["1 G 1"]]]
            },
            {
              "times": 1,
              "items": [[["0 Am 1 Ft 1 C/G 2"], ["1 E 1"]]]
            }
          ]
        }
      ]
    },
    "v": {
      "name": "verse",
      "times": 1,
      "entries": [
        {
          "renderer": "chords-v1",
          "data": [
            {
              "times": 1,
              "items": [[["0 Am 1 Ft 1 C/G 2"]]]
            }
          ]
        }
      ]
    }
  },
  "order": ["i", "c", "d", "v"],
  "lyrics": false,
  "pdf": false,
  "res": [
    {
      "alias": "Wake Me Up Guitar Tutorial - Avicii Guitar Lesson 🎸|100% Accurate Chords + Lead + No Capo + Cover|",
      "author": "GuitarZero2Hero ~ YouTube",
      "link": "https://www.youtube.com/watch?v=_u4wlBmXGmw&t=202s"
    },
    {
      "alias": "Wake Me Up Guitar Cover Acoustic - Avicii 🎸 |Tabs + Chords|",
      "author": "GuitarZero2Hero Express ~ YouTube",
      "link": "https://www.youtube.com/watch?v=ttQ4zKNH3l0"
    }
  ]
}
