{
  "version": "2.0.0",
  "contributors": ["TheAncientOwl"],
  "title": "Someone You Loved",
  "artists": ["Lewis Capaldi"],
  "type": ["acoustic"],
  "notes": [],
  "capo": 1,
  "chordIDs": ["C", "G", "Am", "F", "Dm"],
  "strumms": [],
  "sections": {
    "mv1": {
      "name": "main riff var.",
      "times": 1,
      "entries": [
        {
          "renderer": "gtab-v1",
          "data": "[C] - A3+e0 - G0 - e0 - G0 - e0 - G0 - e0 - G0 - | [G] - E3+B0 - D0 - B0 - D0 - B0 - D0 - B0 - D0 - | [Am] - A0+B1 - D2 - B1 - D2 - B1 - D2 - B1 - D2 - | [F] - E1+G2 - A3 - G2 - A3 - G2 - A3 - G0 - A3 -"
        }
      ]
    },
    "m1": {
      "name": "main riff",
      "times": 1,
      "entries": [
        {
          "renderer": "gtab-v1",
          "data": "[C] - A3+e0 - G0 - e0 - G0 - e0 - G0 - e0 - G0 - | [G] - E3+B0 - D0 - B0 - D0 - B0 - D0 - B0 - D0 - | [Am] - A0+B1 - D2 - B1 - D2 - B1 - D2 - B1 - D2 - | [F] - E1+G2 - A3 - G2 - A3 - G2 - A3 - G2 - A3 -"
        }
      ]
    },
    "m2": {
      "name": "main riff",
      "times": 3,
      "entries": [
        {
          "renderer": "gtab-v1",
          "data": "[C] - A3+e0 - G0 - e0 - G0 - e0 - G0 - e0 - G0 - | [G] - E3+B0 - D0 - B0 - D0 - B0 - D0 - B0 - D0 - | [Am] - A0+B1 - D2 - B1 - D2 - B1 - D2 - B1 - D2 - | [F] - E1+G2 - A3 - G2 - A3 - G2 - A3 - G2 - A3 -"
        }
      ]
    },
    "m3": {
      "name": "main riff",
      "times": 4,
      "entries": [
        {
          "renderer": "gtab-v1",
          "data": "[C] - A3+e0 - G0 - e0 - G0 - e0 - G0 - e0 - G0 - | [G] - E3+B0 - D0 - B0 - D0 - B0 - D0 - B0 - D0 - | [Am] - A0+B1 - D2 - B1 - D2 - B1 - D2 - B1 - D2 - | [F] - E1+G2 - A3 - G2 - A3 - G2 - A3 - G2 - A3 -"
        }
      ]
    },
    "b": {
      "name": "bridge",
      "times": 1,
      "entries": [
        {
          "renderer": "gtab-v1",
          "data": "[Dm] - D0+e1 - G2 - e1 - G2 - e1 - G2 - e1 - G2 - | [Am] - A0+B1 - D2 - B1 - D2 - B1 - D2 - B1 - D2 - | [G] - E3+B0 - D0 - B0 - D0 - B0 - D0 - B0 - D0 - | [G] - E3+B0 - D0 - B0 - D0 - [Am] - A0+B1 - D2 - B1 - D2 -"
        },
        {
          "renderer": "gtab-v1",
          "data": "[Dm] - D0+e1 - G2 - e1 - G2 - e1 - G2 - e1 - G2 - | [Am] - A0+B1 - D2 - B1 - D2 - B1 - D2 - B1 - D2 - | [G] - E3+B0 - D0 - B0 - D0 - B0 - D0 - B0 - D0 - | - - - - - - - - - - - - - - - - - -"
        }
      ]
    },
    "sc": {
      "name": "soft chorus",
      "times": 1,
      "entries": [
        {
          "renderer": "gtab-v1",
          "data": "[C] - A3+B1+e0 - - - - - - - - - - - - - - - | [G] - E3+G0+B0 - - - - - - - - - - - - - - - | [Am] - A0+G2+B1 - - - - - - - - - - - - - - - | [F] - E1+D3+G2 - - - - - - - - - - - - - - -"
        },
        {
          "renderer": "gtab-v1",
          "data": "[C] - A3+B1+e0 - - - - - - - - - - - - - - - | [G] - E3+G0+B0 - - - - - - - - - - - - - - - | [Am] - A0+B1 - D2 - B1 - D2 - B1 - D2 - B1 - D2 - | [F] - E1+G2 - A3 - G2 - A3 - G2 - A3 - G0 - A3 -"
        }
      ]
    },
    "o": {
      "name": "outro",
      "times": 1,
      "entries": [
        {
          "renderer": "gtab-v1",
          "data": "[C] A3+D2+G0+B1+e0 - - - - - - - - - - - - - - - | [G] - E3+A2+D0+G0+B0 - - - - - - - - - - - - - - - | [Am] - A0+D2+G2+B1+e0 - - - - - - - - - - - - - - - | [F] - E1+A3+D3+G2+B1 - - - - - - - - - - - - - - -"
        }
      ]
    }
  },
  "order": ["mv1", "m1", "mv1", "m2", "mv1", "m1", "mv1", "m3", "b", "sc", "m1", "mv1", "o"],
  "lyrics": false,
  "pdf": false,
  "res": [
    {
      "alias": "Someone You Loved Guitar Tutorial Lewis Capaldi Guitar Lesson 🎸|Fingerpicking + Easy Chords + TAB|",
      "author": "GuitarZero2Hero ~ YouTube",
      "link": "https://youtu.be/Z0OcYM5tixs"
    },
    {
      "alias": "Someone You Loved Guitar Cover Lewis Capaldi 🎸 |Tabs + Chords|",
      "author": "GuitarZero2Hero Express ~ YouTube",
      "link": "https://youtu.be/f8RdxRNM6nQ"
    }
  ]
}
