{
  "version": "2.0.0",
  "contributors": ["TheAncientOwl"],
  "title": "The Times They Are A Changin'",
  "artists": ["Bob Dylan"],
  "type": ["acoustic"],
  "notes": [],
  "capo": 3,
  "chordIDs": ["G", "Em", "C", "Csus2", "G/B"],
  "strumms": [["D", "-", "D", "U", "D", "U"]],
  "sections": {
    "i": {
      "name": "intro",
      "times": 1,
      "entries": [
        {
          "renderer": "chords-v1",
          "data": [
            {
              "times": 1,
              "items": [[["0 G 1 G 1 G 1"]]]
            }
          ]
        }
      ]
    },
    "v1": {
      "name": "verse 1",
      "times": 1,
      "entries": [
        {
          "renderer": "chords-v1",
          "data": [
            {
              "times": 1,
              "items": [
                [
                  [
                    "0 G 1 Em 1 C 1 G 1 G 1",
                    "00 G 1 Em 1 C 1 D 1",
                    "0 G 1 Em 1 C 1 G 1 G 1 G 1",
                    "0 G 1 Am 1 D 1 D 1",
                    "0 D 1 Csus2 1 G/B 1 D 1",
                    "0 G 1 G 1 D 1 G 1"
                  ]
                ]
              ]
            }
          ]
        }
      ]
    },
    "b1": {
      "name": "break 1",
      "times": 1,
      "entries": [
        {
          "renderer": "chords-v1",
          "data": [
            {
              "times": 1,
              "items": [[["0 G 1 Em 1 C 1 G 1 G 1 G 1 G 1"]]]
            }
          ]
        }
      ]
    },
    "v2": {
      "name": "verse 2",
      "times": 1,
      "entries": [
        {
          "renderer": "chords-v1",
          "data": [
            {
              "times": 1,
              "items": [
                [
                  [
                    "0 G 1 Em 1 C 1 G 1 G 1",
                    "0 G 1 Em 1 C 1 D 1",
                    "0 G 1 Em 1 C 1 G 1 G 1",
                    "0 G 1 Am 1 D 1 D 1",
                    "0 D 1 Csus2 1 G/B 1 D 1",
                    "0 G 1 G 1 D 1"
                  ]
                ]
              ]
            }
          ]
        }
      ]
    },
    "b2": {
      "name": "break 2",
      "times": 1,
      "entries": [
        {
          "renderer": "chords-v1",
          "data": [
            {
              "times": 1,
              "items": [[["0 G 1 Em 1 C 1 G 1 G 1", "0 D 1 Csus2 1 G/B 1 D 1", "0 D 1 D 1 D 1"]]]
            }
          ]
        }
      ]
    },
    "v3": {
      "name": "verse 3",
      "times": 1,
      "entries": [
        {
          "renderer": "chords-v1",
          "data": [
            {
              "times": 1,
              "items": [
                [
                  [
                    "0 G 1 Em 1 C 1 G 1 G 1",
                    "0 G 1 Em 1 C 1 D 1",
                    "0 G 1 Em 1 C 1 G 1 G 1",
                    "0 G 1 Am 1 D 1 D 1",
                    "0 D 1 Csus2 1 G/B 1 D 1",
                    "0 G 1 C 1 D 1 G 1"
                  ]
                ]
              ]
            }
          ]
        }
      ]
    },
    "b3": {
      "name": "break 3",
      "times": 1,
      "entries": [
        {
          "renderer": "chords-v1",
          "data": [
            {
              "times": 1,
              "items": [[["0 G 1 D 1 Csus2 1 D 1 G 1 G 1"]]]
            }
          ]
        }
      ]
    },
    "v4": {
      "name": "verse 4",
      "times": 1,
      "entries": [
        {
          "renderer": "chords-v1",
          "data": [
            {
              "times": 1,
              "items": [
                [
                  [
                    "0 G 1 Em 1 C 1 G 1 G 1",
                    "0 G 1 Em 1 C 1 D 1",
                    "0 G 1 Em 1 C 1 G 1 G 1",
                    "0 G 1 Am 1 D 1 D 1",
                    "0 G 1 Csus2 1 G/B 1 D 1",
                    "0 G 1 C 1 D 1 G 1"
                  ]
                ]
              ]
            }
          ]
        }
      ]
    },
    "b4": {
      "name": "break 4",
      "times": 1,
      "entries": [
        {
          "renderer": "chords-v1",
          "data": [
            {
              "times": 1,
              "items": [
                [
                  [
                    "0 G 1 Em 1 C 1 G 1 G 1",
                    "0 D 1 Csus2 1 G/B 1 D 1 D 1",
                    "0 G 1 C 1 D 1 G 1",
                    "0 G 1 G 1 G 1"
                  ]
                ]
              ]
            }
          ]
        }
      ]
    },
    "v5": {
      "name": "verse 5",
      "times": 1,
      "entries": [
        {
          "renderer": "chords-v1",
          "data": [
            {
              "times": 1,
              "items": [
                [
                  [
                    "0 G 1 Em 1 C 1 G 1 G 1",
                    "0 G 1 Em 1 C 1 D 1",
                    "0 G 1 Em 1 C 1 G 1 G 1",
                    "0 G 1 Em 1 C 1 G 1 G 1",
                    "0 D 1 Csus2 1 G/B 1 D 1",
                    "0 G 1 C 1 D 1 G 1"
                  ]
                ]
              ]
            }
          ]
        }
      ]
    },
    "o": {
      "name": "outro",
      "times": 1,
      "entries": [
        {
          "renderer": "chords-v1",
          "data": [
            {
              "times": 1,
              "items": [[["0 G 1 Em 1 C 1 G 1"]]]
            }
          ]
        }
      ]
    }
  },
  "order": ["i", "v1", "b1", "v2", "b2", "v3", "b3", "v4", "b4", "v5", "o"],
  "lyrics": false,
  "pdf": false,
  "res": [
    {
      "alias": "The Times They Are A Changin' Guitar Tutorial Bob Dylan Guitar Lesson |Easy Chords + Strumming|",
      "author": "GuitarZero2Hero ~ YouTube",
      "link": "https://youtu.be/oX8_Oshrggc"
    },
    {
      "alias": "The Times They Are A Changin' Guitar Cover Bob Dylan 🎸|Tabs + Chords|",
      "author": "GuitarZero2Hero Express ~ YouTube",
      "link": "https://youtu.be/Qw2mDG9TTQo"
    }
  ]
}
