{
  "version": "2.0.0",
  "contributors": ["TheAncientOwl"],
  "title": "Someone You Loved | Easy",
  "artists": ["Lewis Capaldi"],
  "type": ["acoustic"],
  "notes": [],
  "capo": 1,
  "chordIDs": ["C", "G", "Am", "F", "Dm"],
  "strumms": [["D", "-", "D", "U", "-", "U", "D", "U"], ["D", "-", "D", "U"], ["D"]],
  "sections": {
    "m1": {
      "name": "main progression",
      "times": 13,
      "entries": [
        {
          "renderer": "chords-v1",
          "data": [
            {
              "times": 1,
              "items": [[["0 C 1 G 1 Am 1 F 1"]]]
            }
          ]
        }
      ]
    },
    "b": {
      "name": "bridge",
      "times": 1,
      "entries": [
        {
          "renderer": "chords-v1",
          "data": [
            {
              "times": 1,
              "items": [[["0 Dm 1 Am 1 G 1"], ["1 G 1 Am 1"], ["0 Dm 1 Am 1 G 1"]]]
            }
          ]
        }
      ]
    },
    "m2": {
      "name": "main progression",
      "times": 1,
      "entries": [
        {
          "renderer": "chords-v1",
          "data": [
            {
              "times": 1,
              "items": [[["2 C 1 G 1 Am 1 F 1"]]]
            },
            {
              "times": 1,
              "items": [[["2 C 1 G 1"], ["0 Am 1 F 1"]]]
            },
            {
              "times": 2,
              "items": [[["0 C 1 G 1 Am 1 F 1"]]]
            },
            {
              "times": 1,
              "items": [[["2 C 1 G 1 Am 1 F 1"], ["2 C 1"]]]
            }
          ]
        }
      ]
    }
  },
  "order": ["m1", "b", "m2"],
  "lyrics": false,
  "pdf": false,
  "res": [
    {
      "alias": "Someone You Loved Guitar Tutorial Lewis Capaldi Guitar Lesson 🎸|Fingerpicking + Easy Chords + TAB|",
      "author": "GuitarZero2Hero ~ YouTube",
      "link": "https://youtu.be/Z0OcYM5tixs"
    },
    {
      "alias": "Someone You Loved Guitar Cover Lewis Capaldi 🎸 |Tabs + Chords|",
      "author": "GuitarZero2Hero Express ~ YouTube",
      "link": "https://youtu.be/f8RdxRNM6nQ"
    }
  ]
}
