{
  "version": "2.1.0",
  "contributors": ["TheAncientOwl"],
  "title": "No Surprises",
  "artists": ["Radiohead"],
  "type": ["acoustic", "electric"],
  "notes": ["Lift middle finger after highlighted strum (optional)"],
  "capo": 3,
  "chordIDs": ["D", "Gm6", "G6/B", "A", "Asus4"],
  "strumms": [
    ["De", "U", "D", "-", "D", "-", "D", "U"],
    ["D", "U", "D", "U", "D", "U", "D", "U"],
    ["D", "-", "D", "-", "D", "-", "D", "U"],
    ["D", "-", "D", "-", "D", "-", "-", "-"]
  ],
  "sections": {
    "r": {
      "name": "riff",
      "times": 2,
      "entries": [
        {
          "renderer": "gtab-v1",
          "data": "- [D] e2 - G2 - B3 - G2 - e2 - G2 - B3 - G2 - | - e2 - G2 - B3 - G2 - [Gm6] E3 - G3 - B3 - e0 -"
        }
      ]
    },
    "br": {
      "name": "break",
      "times": 1,
      "entries": [{ "renderer": "chords-v2", "data": ["x2 D 1 D 1 | 0 D 1 ! 0 Gm6 1", "> 0 1"] }]
    },
    "v1": {
      "name": "verse 1",
      "times": 1,
      "entries": [
        {
          "renderer": "chords-v2",
          "data": [
            "x1 D 1 D 1 | 0 D 1 D 1 / 0 G6/B 1 G6/B 1 | 0 G6/B 1 G6/B 1",
            "> 0",
            "x1 Em 1 Em 1 | 0 A 1 A 1",
            "> 2"
          ]
        }
      ]
    },
    "br_x1": {
      "name": "break",
      "times": 1,
      "entries": [{ "renderer": "chords-v2", "data": ["x1 D 1 D 1 | 0 D 1 ! 0 Gm6 1", "> 0 1"] }]
    },
    "v2": {
      "name": "verse 2",
      "times": 1,
      "entries": [
        {
          "renderer": "chords-v2",
          "data": ["x1 D 1 D 1 | 0 D 1 D 1 / 0 G6/B 1 G6/B 1 | 0 G6/B 1 G6/B 1", "> 0"]
        }
      ]
    },
    "c": {
      "name": "chorus",
      "times": 1,
      "entries": [
        {
          "renderer": "chords-v2",
          "data": ["x2 Em 1 Em 1 | 0 A 1 A 1", "x1 Em 1 Em 1 | 0 A 1", "> 2", "x1 A 1", "> 3"]
        }
      ]
    },
    "bdg": {
      "name": "bridge",
      "times": 1,
      "entries": [
        {
          "renderer": "chords-v2",
          "data": ["x2 A 1 Asus4 1 Gm6 1 ! 0 Gm6 1", "> 2 1"]
        },
        {
          "renderer": "chords-v2",
          "data": ["x1 Em 1 Em 1 | 0 Gm6 1 Gm6 1", "> 2"]
        }
      ]
    }
  },
  "order": [
    "r",
    "br",
    "v1",
    "br_x1",
    "v1",
    "br_x1",
    "v2",
    "c",
    "r",
    "v2",
    "c",
    "br_x1",
    "bdg",
    "v2",
    "c",
    "r"
  ],
  "lyrics": false,
  "pdf": false,
  "res": [
    {
      "alias": "No Surprises Guitar Tutorial Radiohead Guitar Lesson |Riff + Chords + TAB|",
      "author": "GuitarZero2Hero ~ YouTube",
      "link": "https://youtu.be/pjzDr2cyeJs"
    },
    {
      "alias": "No Surprises Guitar Cover Radiohead 🎸|Tabs + Chords|",
      "author": "GuitarZero2Hero Express ~ YouTube",
      "link": "https://youtu.be/FJq0qfTcGok"
    }
  ]
}
