{
  "version": "2.0.0",
  "contributors": ["TheAncientOwl"],
  "title": "Birds Of A Feather (Easy)",
  "artists": ["Billie Eilish"],
  "type": ["acoustic"],
  "notes": [],
  "capo": 0,
  "chordIDs": ["D", "Em7_v2", "Bm7", "A"],
  "strumms": [["D", "-", "-", "U", "D", "U", "D", "-", "-", "U", "D", "U", "D", "-", "D", "U"]],
  "sections": {
    "i": {
      "name": "intro",
      "times": 1,
      "entries": [
        {
          "renderer": "chords-v2",
          "data": ["x1 D 1 D 1", "> 0"]
        }
      ]
    },
    "mp": {
      "name": "main progression",
      "times": 11,
      "entries": [
        {
          "renderer": "chords-v2",
          "data": ["x1 D 1 D 1 Bm7 1 Bm7 1", "x1 Em7_v2 1 Em7_v2 1 A 1 A 1", "> 0"]
        }
      ]
    }
  },
  "order": ["i", "mp"],
  "lyrics": false,
  "pdf": false,
  "res": [
    {
      "alias": "Birds Of A Feather Guitar Tutorial Billie Eilish Guitar Chords + Fingerpicking",
      "author": "GuitarZero2Hero ~ YouTube",
      "link": "https://youtu.be/mkx4ZNN4hoQ"
    },
    {
      "alias": "Birds Of A Feather Guitar Cover Billie Eilish 🎸|Tabs + Chords|",
      "author": "GuitarZero2Hero Express ~ YouTube",
      "link": "https://youtu.be/aPCfY2fHA08"
    }
  ]
}
