{
  "version": "2.0.0",
  "contributors": ["TheAncientOwl"],
  "title": "The Night We Met (Studio)",
  "artists": ["Lord Huron"],
  "type": ["electric"],
  "notes": [],
  "capo": 0,
  "chordIDs": ["F#m_9fr", "E_8fr", "A_5fr", "D_5fr"],
  "strumms": [],
  "sections": {
    "i": {
      "name": "intro",
      "times": 2,
      "entries": [
        {
          "renderer": "gtab-v1",
          "data": "[F#m] - A9 - D11 - G11 - B10 - G11 - D11 - | [E] - A7 - D9 - B9 - | [A] - E5 - A7 - D7 - G6 - D7 - A7 - | - E5 - A7 - D7 - G6 - D7 - A7 -"
        },
        {
          "renderer": "gtab-v1",
          "data": "[F#m] - E2 - A4 - - D4 - - G2 - - D4 - - A4 - - | [A] - E5 - A7 - D7 - | [D] - A5 - D7 - G7 - B7 - G7 - D7 - | - A5 - D7 - G7 - B7 - G7 - D7 -"
        }
      ]
    },
    "c": {
      "name": "chorus",
      "times": 2,
      "entries": [
        {
          "renderer": "gtab-v1",
          "data": "[F#m] - A9 - D11 - G11 - B10 - G11 - D11 - | [E] - A7 - D9 - B9 - | [A] - E5 - A7 - D7 - G6 - D7 - A7 - | - E5 - A7 - D7 - G6 - D7 - A7 -"
        },
        {
          "renderer": "gtab-v1",
          "data": "[F#m] - E2 - A4 - - D4 - - G2 - - D4 - - A4 - - | [A] - E5 - A7 - D7 - | [D] - A5 - D7 - G7 - B7 - G7 - D7 - | - A5 - D7 - G7 - B7 - G7 - D7 -"
        }
      ]
    },
    "v": {
      "name": "verse",
      "times": 4,
      "entries": [
        {
          "renderer": "gtab-v1",
          "data": "[F#m] - E2 - A4 - - D4 - - G2 - - D4 - - A4 - - | [A] - E5 - A7 - D7 - | [D] - A5 - D7 - G7 - B7 - G7 - D7 - | - A5 - D7 - G7 - B7 - G7 - D7 -"
        }
      ]
    },
    "vf": {
      "name": "verse",
      "times": 2,
      "entries": [
        {
          "renderer": "gtab-v1",
          "data": "[F#m] - E2 - A4 - - D4 - - G2 - - D4 - - A4 - - | [A] - E5 - A7 - D7 - | [D] - A5 - D7 - G7 - B7 - G7 - D7 - | - A5 - D7 - G7 - B7 - G7 - D7 -"
        }
      ]
    }
  },
  "order": ["i", "c", "v", "c", "v", "c", "vf"],
  "lyrics": false,
  "pdf": false,
  "res": [
    {
      "alias": "The Night We Met Guitar Tutorial 🎸 Lord Huron Guitar Lesson |Easy Chords + Picking + TAB|",
      "author": "GuitarZero2Hero ~ YouTube",
      "link": "https://youtu.be/XEYpA3vj1bA"
    },
    {
      "alias": "The Night We Met Guitar Cover Lord Huron 🎸|Tabs + Chords|",
      "author": "GuitarZero2Hero Express ~ YouTube",
      "link": "https://youtu.be/9YjBCrY_-1s"
    }
  ]
}
