{
  "version": "2.0.0",
  "contributors": ["TheAncientOwl"],
  "title": "O Stea",
  "artists": ["Deepcentral"],
  "type": ["acoustic"],
  "notes": ["Drop D"],
  "capo": 0,
  "chordIDs": ["Em7", "Cadd9", "G", "D"],
  "strumms": [["D", "D", "-", "U", "U", "-", "D", "-", "U", "-", "D", "U"]],
  "sections": {
    "m": {
      "name": "main progression",
      "times": 1,
      "entries": [
        {
          "renderer": "chords-v1",
          "data": [
            {
              "times": 404,
              "items": [[["0 Em7 1 Cadd9 1 G 1 D 1"]]]
            }
          ]
        }
      ]
    }
  },
  "order": ["m"],
  "lyrics": false,
  "pdf": false,
  "res": [
    {
      "alias": "CUM SĂ CÂNȚI \"O STEA\" LA CHITARA!? (DEEPCENTRAL)",
      "author": "Cantam La Chitara ~ YouTube",
      "link": "https://youtu.be/kuhMWv4uNCk"
    }
  ]
}
