{
  "version": "2.0.1",
  "contributors": ["TheAncientOwl"],
  "title": "Stay",
  "artists": ["The Kid LAROI", "Justin Bieber"],
  "type": ["electric"],
  "notes": [],
  "capo": 0,
  "chordIDs": [],
  "strumms": [],
  "sections": {
    "i": {
      "name": "intro",
      "times": 1,
      "entries": [
        {
          "renderer": "gtab-v1",
          "data": "- G5/6 - G6 - B9 - - - - - G6 - G6 - | - G5 - G5 - G5 - G5 - G5 - G6 - G6 - - - | - G5/6 - G6 - B9 - - - - - G6 - G6 - | - G5 - G5 - G5 - G5 - G5 - G6 - G6 - - -"
        },
        {
          "renderer": "gtab-v1",
          "data": "- G5/6 - G6 - B9 - - - - - G6 - G6 - | - G5 - G5 - G5 - G5 - G5 - G6 - G6 - - - | - G5/6 - G6 - B9 - - - - - G6/8 - | - G8 - e8 - - - - - G9~ - - - - - -"
        }
      ]
    },
    "v1": {
      "name": "verse 1",
      "times": 1,
      "entries": [
        {
          "renderer": "gtab-v1",
          "data": "- - - G10\\ - - G6/8 - - - G8 - - | - - - - G8 - - G6 - G8 - - G8 - - - - | - D8 - G10\\ - - G6/8 - - - G8 - - | - - - G8 - - - G6 - G8 - - - G8 - - -"
        },
        {
          "renderer": "gtab-v1",
          "data": "- D8 - G10\\ - - G6/8 - - - G8 - - | - - - G8 - - - G6 - G8 - - - G8 - - - | - B9 - - - B6 - - - B9 - - - B6 - - - | - G8 - G8 - G8 - B6 - G8^ B^ G^6 - - -"
        }
      ]
    },
    "pc": {
      "name": "prechorus",
      "times": 1,
      "entries": [
        {
          "renderer": "gtab-v1",
          "data": "- G5/6 - - - - D8 - G8/10 - - - | - G10 - - - - - - - - - - - - - - | - G5/6 - - - - D8 - G8/10 - - - | - G10 - - - - - - - - - - - - - -"
        },
        {
          "renderer": "gtab-v1",
          "data": "- G5/6 - - - - D8 - G8/10 - - - | - G10 - - - - - - - - - - - - - - | - B9 - - - B6 - - - B9 - - - B6 - - - | - G8 - G8 - G8 - B6 - G8^ B^ G^6 - - -"
        }
      ]
    },
    "c": {
      "name": "chorus",
      "times": 2,
      "entries": [
        {
          "renderer": "gtab-v1",
          "data": "- G5/6 - G6 - B9 - - - - - G6 - G6 - | - G5 - G5 - G5 - G5 - G5 - G6 - G6 - - - | - G5/6 - G6 - B9 - - - - - G6 - G6 - | - G5 - G5 - G5 - G5 - G5 - G6 - G6 - - -"
        },
        {
          "renderer": "gtab-v1",
          "data": "- G5/6 - G6 - B9 - - - - - G6 - G6 - | - G5 - G5 - G5 - G5 - G5 - G6 - G6 - - - | - G5/6 - G6 - B9 - - - - - G6/8 - | - G8 - e8 - - - - - B9~ - - - - - -"
        }
      ]
    },
    "v2": {
      "name": "verse 2",
      "times": 1,
      "entries": [
        {
          "renderer": "gtab-v1",
          "data": "- - B6 - B6 - B6 - B6 - G6 - G6 - G6 - - | - G6 - G8 - G8~ - - - - - - - - - - | - - B6 - B6 - B6 - B6 - G6 - G6 - G6 - - | - G6 - G8 - G8 - - - - G6 - G8 - G6 - -"
        },
        {
          "renderer": "gtab-v1",
          "data": "- - B6 - B6 - B6 - B6 - G6 - G6 - G6 - - | - G6 - G8 - G8~ - - - - - - - - - - | - - B6 - B6 - B6 - B6 - G6 - G6 - G6 - - | - G6 - G8 - G8 - - - - G6 - G8 - G6 - -"
        },
        {
          "renderer": "gtab-v1",
          "data": "- - e8 - e8 - e9 - - - G8 - G8 - G6 - - | - G8 - - G8 - G6 - G8 - - G8/10 - - | - - G8 - G8 - G6 - G8 - G8 - G8 - G6 - - | - - G8 - - G8/10 - - G5 - - G6 - -"
        },
        {
          "renderer": "gtab-v1",
          "data": "- - G6 - B6 - G8 - - - G6 - B6 - G8 - - | - - G8 - G6 - B6 - G8 - - - D8 - - - - | - - G6 - G6 - G6 - G6 - G6/8 - - e8 - | - e6 - - B9 - - - - - - - - - - - -"
        }
      ]
    },
    "o": {
      "name": "outro",
      "times": 1,
      "entries": [
        {
          "renderer": "gtab-v1",
          "data": "- G- - - - - - - - - - - - - - - - | - G- - - - - - - - - - - - - - - - | - G5/6 - G6 - B9 - - - - - G6/8 - | - G8 - e8 - - - - - B9~ - - - - - -"
        }
      ]
    }
  },
  "order": ["i", "v1", "pc", "c", "v2", "pc", "c", "o"],
  "lyrics": false,
  "pdf": false,
  "res": [
    {
      "alias": "Stay - The Kid LAROI, Justin Bieber - Instrumental Guitar Cover + TAB",
      "author": "gitar online",
      "link": "https://youtu.be/JjOYiWvLgdQ"
    }
  ]
}
