{
  "version": "2.0.0",
  "contributors": ["TheAncientOwl"],
  "title": "Save Your Tears",
  "artists": ["The Weekend", "Ariana Grande"],
  "type": ["acoustic"],
  "notes": [],
  "capo": 0,
  "chordIDs": ["C", "Am", "Em", "G", "Ft"],
  "strumms": [
    ["D", "-", "D", "-", "De", "-", "D", "-", "D", "-", "D", "-", "De", "-", "D", "-"],
    ["D", "D"],
    ["D", "U", "D", "U", "D", "U", "D", "U"],
    ["D", "U", "D", "U", "D", "-", "-", "-"],
    ["D", "-", "D", "-", "D", "-", "D", "-"],
    ["D"]
  ],
  "sections": {
    "i": {
      "name": "intro",
      "times": 1,
      "entries": [
        {
          "renderer": "chords-v1",
          "data": [
            {
              "times": 1,
              "items": [[["0 C 4"]]]
            }
          ]
        }
      ]
    },
    "v1": {
      "name": "verse 1",
      "times": 8,
      "entries": [
        {
          "renderer": "chords-v1",
          "data": [
            {
              "times": 1,
              "items": [[["0 C 1 Am 1 Em 1 G 1"]]]
            }
          ]
        }
      ]
    },
    "pr1": {
      "name": "prechorus 1",
      "times": 1,
      "entries": [
        {
          "renderer": "chords-v1",
          "data": [
            {
              "times": 1,
              "items": [[["0 Dm 1 Am 1 Ft 1 G 1"]]]
            }
          ]
        }
      ]
    },
    "c1": {
      "name": "chorus 1",
      "times": 1,
      "entries": [
        {
          "renderer": "chords-v1",
          "data": [
            {
              "times": 1,
              "items": [[["1 C 1 Am 1"], ["2 Em 1 G 1"]]]
            },
            {
              "times": 1,
              "items": [[["1 C 1 Am 1"], ["2 Em 1"], ["3 G 1"]]]
            }
          ]
        }
      ]
    },
    "v2": {
      "name": "verse 2",
      "times": 4,
      "entries": [
        {
          "renderer": "chords-v1",
          "data": [
            {
              "times": 1,
              "items": [[["0 C 1 Am 1 Em 1 G 1"]]]
            }
          ]
        }
      ]
    },
    "pr2": {
      "name": "prechorus 2",
      "times": 1,
      "entries": [
        {
          "renderer": "chords-v1",
          "data": [
            {
              "times": 1,
              "items": [[["0 Dm 1 Am 1 Ft 1"]]]
            },
            {
              "times": 1,
              "items": [[["4 F 1 G 1"]]]
            },
            {
              "times": 1,
              "items": [[["0 Dm 1 Am 1 Ft 1 G 1"]]]
            }
          ]
        }
      ]
    },
    "b": {
      "name": "bridge",
      "times": 2,
      "entries": [
        {
          "renderer": "chords-v1",
          "data": [
            {
              "times": 1,
              "items": [[["5 C 1 Am 1 Em 1 G 1"]]]
            }
          ]
        }
      ]
    },
    "c2": {
      "name": "chorus 2",
      "times": 4,
      "entries": [
        {
          "renderer": "chords-v1",
          "data": [
            {
              "times": 1,
              "items": [[["2 C 1 Am 1 Em 1 G 1"]]]
            }
          ]
        }
      ]
    }
  },
  "order": ["i", "v1", "pr1", "c1", "v2", "pr2", "c1", "b", "c2"],
  "lyrics": false,
  "pdf": false,
  "res": [
    {
      "alias": "Save Your Tears Guitar Tutorial The Weeknd Guitar Lesson |Easy Chords|",
      "author": "GuitarZero2Hero ~ YouTube",
      "link": "https://youtu.be/aPuujELV4Hg"
    },
    {
      "alias": "Save Your Tears Guitar Cover The Weeknd 🎸|Tabs + Chords|",
      "author": "GuitarZero2Hero Express ~ YouTube",
      "link": "https://youtu.be/NF-gjc8-fz0?"
    }
  ]
}
