{
  "version": "2.1.0",
  "contributors": ["TheAncientOwl"],
  "title": "Dusk Till Dawn",
  "artists": ["Zayn", "Sia"],
  "type": ["acoustic"],
  "notes": [],
  "capo": 2,
  "chordIDs": ["Am", "Ft", "C", "G/B", "Em", "C/E"],
  "strumms": [
    ["D"],
    ["D", "D", "D", "D", "De", "D", "D", "D"],
    ["D", "-", "-", "-", "D", "-", "D", "U"],
    ["D", "-", "D", "-", "D", "-", "D", "U"]
  ],
  "sections": {
    "vpi": {
      "name": "verse / prechorus",
      "times": 1,
      "entries": [
        {
          "renderer": "chords-v2",
          "data": [
            "x3 Am 1 F 1 C 1 G/B 1",
            "> 0",
            "x1 Am 1 F 1 C 1 G/B 1",
            "> 1",
            "x2 Am 1 F 1 C 1 G/B 1",
            "> 0"
          ]
        }
      ]
    },
    "c": {
      "name": "chorus",
      "times": 1,
      "entries": [
        {
          "renderer": "chords-v2",
          "data": ["x1 Am 1", "> 2", "x4 Am 2 F 2 C 2 Em 2", "> 3"]
        }
      ]
    },
    "bk": {
      "name": "break",
      "times": 1,
      "entries": [
        {
          "renderer": "chords-v2",
          "data": ["x1 Am 1", "> 0"]
        }
      ]
    },
    "vp": {
      "name": "verse / prechorus",
      "times": 1,
      "entries": [
        {
          "renderer": "chords-v2",
          "data": ["x3 Am 1 F 1 C 1 G/B 1", "> 1", "x2 Am 1 F 1 C 1 G/B 1", "> 0"]
        }
      ]
    },
    "b": {
      "name": "bridge",
      "times": 1,
      "entries": [
        {
          "renderer": "chords-v2",
          "data": [
            "x1 F 1 | 0 F 1 C 1 | 0 C 1 G 1 | 0 G 1 C/E 1",
            "x1 F 1 | 0 F 1 C 1 | 0 C 1 G 1 | 0 G 1 G 1",
            "> 0"
          ]
        }
      ]
    }
  },
  "order": ["vpi", "c", "bk", "vp", "c", "b", "c"],
  "lyrics": false,
  "pdf": false,
  "res": [
    {
      "alias": "Dusk Till Dawn Guitar Tutorial - Zayn feat Sia Guitar Lesson 🎸 |Chords + No Capo + Guitar Cover|",
      "author": "GuitarZero2Hero ~ YouTube",
      "link": "https://youtu.be/v2AMU6dh0pA"
    },
    {
      "alias": "Dusk Till Dawn Guitar Cover Acoustic - Zayn Feat Sia 🎸 |Tabs + Chords|",
      "author": "GuitarZero2Hero Express ~ YouTube",
      "link": "https://youtu.be/qT8s6mvDzxw"
    }
  ]
}
