{
  "version": "2.1.0",
  "contributors": ["TheAncientOwl"],
  "title": "California Dreamin'",
  "artists": ["The Mamas & The Papas"],
  "type": ["acoustic"],
  "notes": [],
  "capo": 4,
  "chordIDs": ["Am", "C", "F", "G", "E7", "E7sus4"],
  "strumms": [["D", "U", "D", "U"], ["D"]],
  "sections": {
    "i1": {
      "name": "intro guitar 1",
      "times": 1,
      "entries": [
        {
          "renderer": "gtab-v1",
          "data": "[Asus2] - D2 - G2 - B0 - D2 - B3 - B1 - B0 - | - D2 - G2 - B0 - D2 - B3 - B1 - B0 - | - D2 - G2 - B0 - D2 - B3 - B1 - B0 - | [E7sus4] - E0+A2+D0+G2+B0+e0 - - - - - - - - - - - - -"
        }
      ]
    },
    "i2": {
      "name": "intro guitar 2",
      "times": 1,
      "entries": [
        {
          "renderer": "gtab-v1",
          "data": "[Asus2] - - - - - - - - - - - - - - - | - - - - - e0 - e1 - e1 - - B3 - - | - B1 - - B2 - B1 - B0 - G2 - - G0 - | [E7sus4] - E0+A2+D0+G2+B0+e0 - - - - - - - - - - - - -"
        }
      ]
    },
    "v1": {
      "name": "verse 1",
      "times": 1,
      "entries": [
        {
          "renderer": "chords-v2",
          "data": [
            "x1 Am 1 G 1 | 0 F 1 G 1 / 0 E7sus4 1 E7sus4 1 | 0 E7 1 F 1",
            "x1 C 1 E7 1 | 0 Am 1 F 1 / 0 E7sus4 1 E7sus4 1 | 0 E7 1 E7 1",
            "x2 Am 1 G 1 | 0 F 1 G 1 / 0 E7sus4 1 E7sus4 1 | 0 E7 1 E7 1",
            "> 0"
          ]
        }
      ]
    },
    "v2": {
      "name": "verse 2",
      "times": 1,
      "entries": [
        {
          "renderer": "chords-v2",
          "data": [
            "x1 Am 1 G 1 | 0 F 1 G 1 / 0 E7sus4 1 E7sus4 1 | 0 E7 1 F 1",
            "x1 C 1 E7 1 | 0 Am 1 F 1 / 0 E7sus4 1 E7sus4 1 | 0 E7 1 E7 1",
            "x2 Am 1 G 1 | 0 F 1 G 1 / 0 E7sus4 1 E7sus4 1 | 0 E7 1 E7 1",
            "> 0"
          ]
        }
      ]
    },
    "s": {
      "name": "solo",
      "times": 1,
      "entries": [
        {
          "renderer": "gtab-v1",
          "data": "- G5▲ - - - - - - - - - - - - | - G▼5 - - G4 - G5 - G5/7 - - G5^4 - | - G5▲ - - - - - - - - - - - - | - G▼5 - - G4 - G5 - G5/7 - - G5^4"
        },
        {
          "renderer": "gtab-v1",
          "data": "- D5 - - - - - - D6 - - - - - - | - D7 - - - - - - B6 - - - - - - | - B5 - - - - - - - - G7/5 - | - G7/9 - - B5 - e5 - - e7 - - e5 - e7 - e5 - B8 -"
        },
        {
          "renderer": "gtab-v1",
          "data": "- e5 - - e5 - - B8 - - B8 - B6▲ - | - B▼6 - - e5 - - e7 - - e5 - - B8 - - B5▲ - | - B▼5 - - - G7/5 - G7/9▲ - | - G▼9 - - - G9 - B8 - e7 - - e7 -"
        },
        {
          "renderer": "gtab-v1",
          "data": "- e8 - - e8 - - e7 - - e7 - e5▲ - | - e▼5 - - e8 - - e5 - - e8 - - e8 - - - e7▲ - | - e▼7 - - e10 - e10 - e7 - e7 - B9 - | - B9 - B6 - B6 - B5 - B5 - B6 - B5 -"
        }
      ]
    },
    "v3": {
      "name": "verse 3",
      "times": 1,
      "entries": [
        {
          "renderer": "chords-v2",
          "data": [
            "x1 Am 1 G 1 | 0 F 1 G 1 / 0 E7sus4 1 E7sus4 1 | 0 E7 1 F 1",
            "x1 C 1 E7 1 | 0 Am 1 F 1 / 0 E7sus4 1 E7sus4 1 | 0 E7 1 E7 1",
            "x1 Am 1 G 1 | 0 F 1 G 1 / 0 E7sus4 1 E7sus4 1 | 0 E7 1 E7 1",
            "> 0"
          ]
        }
      ]
    },
    "o": {
      "name": "outro",
      "times": 1,
      "entries": [
        {
          "renderer": "chords-v2",
          "data": ["x3 Am 1 G 1 | 0 F 1 G 1", "x1 F 1 F 1 | 0 F 1 F 1", "> 0", "x1 Am 1", "> 1"]
        }
      ]
    }
  },
  "order": ["i1", "i2", "v1", "v2", "s", "v3", "o"],
  "lyrics": false,
  "pdf": false,
  "res": [
    {
      "alias": "California Dreamin’ Guitar Tutorial The Mamas & The Papas Lesson | Chords + Strumming + Solo |",
      "author": "GuitarZero2Hero ~ YouTube",
      "link": "https://youtu.be/SnU7gwkvtE8"
    }
  ]
}
